[
    {
        "data_source": "oklink",
        "monitored_date": "04/19/2024",
        "results": [],
        "created_date": "2024-04-19 06:30:14"
    },
    {
        "data_source": "oklink",
        "monitored_date": "04/19/2024",
        "results": [],
        "created_date": "2024-04-19 16:16:57"
    },
    {
        "data_source": "oklink",
        "monitored_date": "04/20/2024",
        "results": [],
        "created_date": "2024-04-20 16:16:54"
    },
    {
        "data_source": "oklink",
        "results": [],
        "created_date": "2024-04-21 16:17:06"
    },
    {
        "data_source": "oklink",
        "results": [],
        "created_date": "2024-04-22 16:18:59"
    },
    {
        "data_source": "oklink",
        "results": [],
        "created_date": "2024-04-23 16:18:04"
    },
    {
        "data_source": "oklink",
        "results": [],
        "created_date": "2024-04-24 16:17:38"
    },
    {
        "data_source": "oklink",
        "monitored_date": "04/26/2024",
        "results": [],
        "created_date": "2024-04-26 16:18:57"
    },
    {
        "data_source": "oklink",
        "results": [],
        "created_date": "2024-04-27 16:16:48"
    },
    {
        "data_source": "oklink",
        "results": [],
        "created_date": "2024-04-28 16:15:55"
    },
    {
        "data_source": "oklink",
        "monitored_date": "04/29/2024",
        "results": [],
        "created_date": "2024-04-29 16:17:18"
    },
    {
        "data_source": "oklink",
        "monitored_date": "04/30/2024",
        "results": [],
        "created_date": "2024-04-30 16:21:38"
    },
    {
        "data_source": "oklink",
        "monitored_date": "05/01/2024",
        "results": [],
        "created_date": "2024-05-01 16:21:41"
    },
    {
        "data_source": "oklink",
        "monitored_date": "05/02/2024",
        "results": [
            {
                "time_recorded": "14:41:39",
                "title": "Large transfers",
                "amount": "568,675",
                "token": "USDC",
                "from_address": "0xf025c1baaa2e88cb52109809858d2530b9bf7298",
                "from_wallet_address": "0xf025c1baaa2e88cb52109809858d2530b9bf7298",
                "to_address": "Deribit",
                "to_wallet_address": "0x77021d475e36b3ab1921a0e3a8380f069d3263de",
                "txn_hash": "0x8801d0758a70ec3863a471546b54970964a7400fb9020bf90c1070a46536d628"
            }
        ],
        "created_date": "2024-05-02 16:17:47"
    },
    {
        "data_source": "oklink",
        "monitored_date": "05/03/2024",
        "results": [],
        "created_date": "2024-05-03 16:18:49"
    },
    {
        "data_source": "oklink",
        "monitored_date": "05/04/2024",
        "results": [],
        "created_date": "2024-05-04 16:20:12"
    },
    {
        "data_source": "oklink",
        "monitored_date": "05/05/2024",
        "results": [],
        "created_date": "2024-05-05 16:17:17"
    },
    {
        "data_source": "oklink",
        "monitored_date": "05/06/2024",
        "results": [],
        "created_date": "2024-05-06 16:19:19"
    },
    {
        "data_source": "oklink",
        "monitored_date": "05/07/2024",
        "results": [],
        "created_date": "2024-05-07 16:17:07"
    },
    {
        "data_source": "oklink",
        "monitored_date": "05/08/2024",
        "results": [],
        "created_date": "2024-05-08 16:19:30"
    },
    {
        "data_source": "oklink",
        "monitored_date": "05/09/2024",
        "results": [],
        "created_date": "2024-05-09 16:20:25"
    },
    {
        "data_source": "oklink",
        "monitored_date": "05/10/2024",
        "results": [],
        "created_date": "2024-05-10 16:18:48"
    },
    {
        "data_source": "oklink",
        "monitored_date": "05/11/2024",
        "results": [],
        "created_date": "2024-05-11 16:18:18"
    },
    {
        "data_source": "oklink",
        "monitored_date": "05/12/2024",
        "results": [],
        "created_date": "2024-05-12 16:18:20"
    },
    {
        "data_source": "oklink",
        "monitored_date": "05/13/2024",
        "results": [],
        "created_date": "2024-05-13 16:19:13"
    },
    {
        "data_source": "oklink",
        "monitored_date": "05/14/2024",
        "results": [],
        "created_date": "2024-05-14 16:18:52"
    },
    {
        "data_source": "oklink",
        "monitored_date": "05/15/2024",
        "results": [],
        "created_date": "2024-05-15 16:17:59"
    },
    {
        "data_source": "oklink",
        "monitored_date": "05/16/2024",
        "results": [],
        "created_date": "2024-05-16 16:16:46"
    },
    {
        "data_source": "oklink",
        "monitored_date": "05/17/2024",
        "results": [],
        "created_date": "2024-05-17 16:17:24"
    },
    {
        "data_source": "oklink",
        "monitored_date": "05/18/2024",
        "results": [],
        "created_date": "2024-05-18 16:15:39"
    },
    {
        "data_source": "oklink",
        "results": [],
        "created_date": "2024-05-19 16:17:26"
    },
    {
        "data_source": "oklink",
        "monitored_date": "05/20/2024",
        "results": [],
        "created_date": "2024-05-20 16:18:06"
    },
    {
        "data_source": "oklink",
        "monitored_date": "05/21/2024",
        "results": [],
        "created_date": "2024-05-21 16:19:28"
    },
    {
        "data_source": "oklink",
        "monitored_date": "05/22/2024",
        "results": [],
        "created_date": "2024-05-22 16:21:32"
    },
    {
        "data_source": "oklink",
        "monitored_date": "05/23/2024",
        "results": [],
        "created_date": "2024-05-23 16:18:08"
    },
    {
        "data_source": "oklink",
        "monitored_date": "05/24/2024",
        "results": [],
        "created_date": "2024-05-24 16:18:03"
    },
    {
        "data_source": "oklink",
        "monitored_date": "05/25/2024",
        "results": [],
        "created_date": "2024-05-25 16:19:00"
    },
    {
        "data_source": "oklink",
        "results": [],
        "created_date": "2024-05-26 16:18:04"
    },
    {
        "data_source": "oklink",
        "monitored_date": "05/27/2024",
        "results": [],
        "created_date": "2024-05-27 16:17:07"
    },
    {
        "data_source": "oklink",
        "monitored_date": "05/28/2024",
        "results": [],
        "created_date": "2024-05-28 16:17:09"
    },
    {
        "data_source": "oklink",
        "monitored_date": "05/29/2024",
        "results": [],
        "created_date": "2024-05-29 16:18:17"
    },
    {
        "data_source": "oklink",
        "monitored_date": "05/30/2024",
        "results": [],
        "created_date": "2024-05-30 16:19:01"
    },
    {
        "data_source": "oklink",
        "monitored_date": "05/31/2024",
        "results": [],
        "created_date": "2024-05-31 16:17:40"
    },
    {
        "data_source": "oklink",
        "monitored_date": "06/01/2024",
        "results": [],
        "created_date": "2024-06-01 16:23:54"
    },
    {
        "data_source": "oklink",
        "monitored_date": "06/02/2024",
        "results": [],
        "created_date": "2024-06-02 16:19:17"
    },
    {
        "data_source": "oklink",
        "monitored_date": "06/03/2024",
        "results": [
            {
                "time_recorded": "21:53:27",
                "title": "Large transfers",
                "amount": "599,995",
                "token": "USDT",
                "from_address": "0x22ac346c821d6c5b29d10204bf0a95fe05176ab7",
                "from_wallet_address": "0x22ac346c821d6c5b29d10204bf0a95fe05176ab7",
                "to_address": "Deribit",
                "to_wallet_address": "0x77021d475e36b3ab1921a0e3a8380f069d3263de",
                "txn_hash": "0x3e54d61db5a6281f40190b0536825165be3993bf9d5bc63c78fcf7d508c46ec4"
            }
        ],
        "created_date": "2024-06-04 08:58:02"
    },
    {
        "data_source": "oklink",
        "monitored_date": "06/04/2024",
        "results": [
            {
                "time_recorded": "04:31:27",
                "title": "Large transfers",
                "amount": "500,000",
                "token": "USDC",
                "from_address": "0x22ac346c821d6c5b29d10204bf0a95fe05176ab7",
                "from_wallet_address": "0x22ac346c821d6c5b29d10204bf0a95fe05176ab7",
                "to_address": "Deribit",
                "to_wallet_address": "0x77021d475e36b3ab1921a0e3a8380f069d3263de",
                "txn_hash": "0xfe1e1825b03c057a172112e5f3ee0af237ec321735bee3a6ad08a80c611bb83b"
            },
            {
                "time_recorded": "01:32:52",
                "title": "Large transfers",
                "amount": "999,956.28",
                "token": "USDT",
                "from_address": "0x22ac346c821d6c5b29d10204bf0a95fe05176ab7",
                "from_wallet_address": "0x22ac346c821d6c5b29d10204bf0a95fe05176ab7",
                "to_address": "Deribit",
                "to_wallet_address": "0x77021d475e36b3ab1921a0e3a8380f069d3263de",
                "txn_hash": "0x0fd8f347bfc15f85e592111b2d9da8db7cead2eb6745c115b7cee799c0bd0a2e"
            }
        ],
        "created_date": "2024-06-05 08:57:38"
    },
    {
        "data_source": "oklink",
        "monitored_date": "06/05/2024",
        "results": [],
        "created_date": "2024-06-06 08:57:51"
    },
    {
        "data_source": "oklink",
        "monitored_date": "06/06/2024",
        "results": [
            {
                "time_recorded": "20:22:03",
                "title": "Large transfers",
                "amount": "899,995",
                "token": "USDT",
                "from_address": "0x5f6b311a160d30dd38d7c05d044af8b6f8dc5bea",
                "from_wallet_address": "0x5f6b311a160d30dd38d7c05d044af8b6f8dc5bea",
                "to_address": "Deribit",
                "to_wallet_address": "0x77021d475e36b3ab1921a0e3a8380f069d3263de",
                "txn_hash": "0x99177d676b122223554fb1dab97e09d8a4d9ae731d75d5a3e0d441f69dcea962"
            },
            {
                "time_recorded": "15:37:04",
                "title": "Large transfers",
                "amount": "2,000,000",
                "token": "USDC",
                "from_address": "0x5f6b311a160d30dd38d7c05d044af8b6f8dc5bea",
                "from_wallet_address": "0x5f6b311a160d30dd38d7c05d044af8b6f8dc5bea",
                "to_address": "Deribit",
                "to_wallet_address": "0x77021d475e36b3ab1921a0e3a8380f069d3263de",
                "txn_hash": "0xd5a988e06865a94caa7820a6919f0ab0e6f464b0e7052a60b8f4fa151a2dd323"
            },
            {
                "time_recorded": "15:06:28",
                "title": "Large transfers",
                "amount": "1,000,000",
                "token": "USDT",
                "from_address": "0x5f6b311a160d30dd38d7c05d044af8b6f8dc5bea",
                "from_wallet_address": "0x5f6b311a160d30dd38d7c05d044af8b6f8dc5bea",
                "to_address": "Deribit",
                "to_wallet_address": "0x77021d475e36b3ab1921a0e3a8380f069d3263de",
                "txn_hash": "0x5eb03019f4ad5d9a7d703dd57aaf387fd8e5cec5da2a11d37d6cee9d7df026ad"
            },
            {
                "time_recorded": "04:09:39",
                "title": "Large transfers",
                "amount": "750,000",
                "token": "USDC",
                "from_address": "0x5f6b311a160d30dd38d7c05d044af8b6f8dc5bea",
                "from_wallet_address": "0x5f6b311a160d30dd38d7c05d044af8b6f8dc5bea",
                "to_address": "Deribit",
                "to_wallet_address": "0x77021d475e36b3ab1921a0e3a8380f069d3263de",
                "txn_hash": "0x2fb86801dd0e563e02c160e5b444578d7ed88ca3c7708d4e6fc407c9142dbf9a"
            },
            {
                "time_recorded": "03:09:39",
                "title": "Large transfers",
                "amount": "6,502,160.79",
                "token": "USDC",
                "from_address": "0x5f6b311a160d30dd38d7c05d044af8b6f8dc5bea",
                "from_wallet_address": "0x5f6b311a160d30dd38d7c05d044af8b6f8dc5bea",
                "to_address": "Deribit",
                "to_wallet_address": "0x77021d475e36b3ab1921a0e3a8380f069d3263de",
                "txn_hash": "0xa3f3c2e4eac29eab58d8574fc89510d2fd7045c433d93954710cdfb6f1e259b8"
            }
        ],
        "created_date": "2024-06-07 08:59:09"
    },
    {
        "data_source": "oklink",
        "monitored_date": "06/07/2024",
        "results": [
            {
                "time_recorded": "16:36:03",
                "title": "Large transfers",
                "amount": "500,000",
                "token": "USDC",
                "from_address": "0x9fee57b78507274355e9ae2298b199459c97f45d",
                "from_wallet_address": "0x9fee57b78507274355e9ae2298b199459c97f45d",
                "to_address": "Deribit",
                "to_wallet_address": "0x77021d475e36b3ab1921a0e3a8380f069d3263de",
                "txn_hash": "0xed940bc777cc32c53d3aa51e6618b8a9436e1182915b21c7f6be41dba33e87a7"
            },
            {
                "time_recorded": "05:59:03",
                "title": "Large transfers",
                "amount": "1,847,593",
                "token": "USDT",
                "from_address": "0x9fee57b78507274355e9ae2298b199459c97f45d",
                "from_wallet_address": "0x9fee57b78507274355e9ae2298b199459c97f45d",
                "to_address": "Deribit",
                "to_wallet_address": "0x77021d475e36b3ab1921a0e3a8380f069d3263de",
                "txn_hash": "0xde721ebab94e28d8a0d90921cfc2c1f0eebf66db058157fdef4cdd7234ee635d"
            },
            {
                "time_recorded": "00:50:17",
                "title": "Large transfers",
                "amount": "799,990",
                "token": "USDC",
                "from_address": "0x9fee57b78507274355e9ae2298b199459c97f45d",
                "from_wallet_address": "0x9fee57b78507274355e9ae2298b199459c97f45d",
                "to_address": "Deribit",
                "to_wallet_address": "0x77021d475e36b3ab1921a0e3a8380f069d3263de",
                "txn_hash": "0x4e00fb1ce76e871741c14468897002b2c0123203ed5ac64efc90fb16e8daefee"
            },
            {
                "time_recorded": "00:49:28",
                "title": "Large transfers",
                "amount": "750,000",
                "token": "USDC",
                "from_address": "0x9fee57b78507274355e9ae2298b199459c97f45d",
                "from_wallet_address": "0x9fee57b78507274355e9ae2298b199459c97f45d",
                "to_address": "Deribit",
                "to_wallet_address": "0x77021d475e36b3ab1921a0e3a8380f069d3263de",
                "txn_hash": "0xe50369844503deaf2cfb1a70ea2d44def419f768408343dff02ef647855bc9ca"
            },
            {
                "time_recorded": "00:21:04",
                "title": "Large transfers",
                "amount": "888,240",
                "token": "USDT",
                "from_address": "0x9fee57b78507274355e9ae2298b199459c97f45d",
                "from_wallet_address": "0x9fee57b78507274355e9ae2298b199459c97f45d",
                "to_address": "Deribit",
                "to_wallet_address": "0x77021d475e36b3ab1921a0e3a8380f069d3263de",
                "txn_hash": "0xe52c3b55947a1bfcc31a194af56a43dd14181b1cca4a1773f4117498ad483ca9"
            }
        ],
        "created_date": "2024-06-08 08:59:39"
    },
    {
        "data_source": "oklink",
        "monitored_date": "06/08/2024",
        "results": [
            {
                "time_recorded": "03:19:04",
                "title": "Large transfers",
                "amount": "1,000,000",
                "token": "USDC",
                "from_address": "0x9fee57b78507274355e9ae2298b199459c97f45d",
                "from_wallet_address": "0x9fee57b78507274355e9ae2298b199459c97f45d",
                "to_address": "Deribit",
                "to_wallet_address": "0x77021d475e36b3ab1921a0e3a8380f069d3263de",
                "txn_hash": "0x4b03fcaa8fb106a10f9e6d4efb04730e752264b2f1705f9df48d790c689198c4"
            },
            {
                "time_recorded": "01:21:15",
                "title": "Large transfers",
                "amount": "556,990",
                "token": "USDC",
                "from_address": "0x9fee57b78507274355e9ae2298b199459c97f45d",
                "from_wallet_address": "0x9fee57b78507274355e9ae2298b199459c97f45d",
                "to_address": "Deribit",
                "to_wallet_address": "0x77021d475e36b3ab1921a0e3a8380f069d3263de",
                "txn_hash": "0x69ac1ea7cb4a94f0cfe3c678d68c12612820e5dcb07cc14ff106c9abae07f401"
            }
        ],
        "created_date": "2024-06-09 09:02:38"
    },
    {
        "data_source": "oklink",
        "monitored_date": "06/09/2024",
        "results": [],
        "created_date": "2024-06-10 09:02:27"
    },
    {
        "data_source": "oklink",
        "monitored_date": "06/10/2024",
        "results": [
            {
                "time_recorded": "23:37:51",
                "title": "Large transfers",
                "amount": "1,224,990",
                "token": "USDC",
                "from_address": "Deribit",
                "from_wallet_address": "0x77021d475e36b3ab1921a0e3a8380f069d3263de",
                "to_address": "0xa294cca691e4c83b1fc0c8d63d9a3eef0a196de1",
                "to_wallet_address": "0xa294cca691e4c83b1fc0c8d63d9a3eef0a196de1",
                "txn_hash": "0xddcfa0cabfb34d0a7432c6cef27bb0951d29e421973a617a02baf1b53dc10e10"
            },
            {
                "time_recorded": "22:16:27",
                "title": "Large transfers",
                "amount": "799,994.563264",
                "token": "USDC",
                "from_address": "Deribit",
                "from_wallet_address": "0x77021d475e36b3ab1921a0e3a8380f069d3263de",
                "to_address": "0xa294cca691e4c83b1fc0c8d63d9a3eef0a196de1",
                "to_wallet_address": "0xa294cca691e4c83b1fc0c8d63d9a3eef0a196de1",
                "txn_hash": "0x4c14dc8f07ac9b9ba48086c5342e1ac4b145458c98c924fd643234ccac02d6bf"
            }
        ],
        "created_date": "2024-06-11 09:00:50"
    },
    {
        "data_source": "oklink",
        "monitored_date": "06/11/2024",
        "results": [
            {
                "time_recorded": "00:20:16",
                "title": "Large transfers",
                "amount": "501,401",
                "token": "USDC",
                "from_address": "Deribit",
                "from_wallet_address": "0x77021d475e36b3ab1921a0e3a8380f069d3263de",
                "to_address": "0xa294cca691e4c83b1fc0c8d63d9a3eef0a196de1",
                "to_wallet_address": "0xa294cca691e4c83b1fc0c8d63d9a3eef0a196de1",
                "txn_hash": "0x959d0d701c04488afc463250f7f43e04632e2eabd308aa02c0ed53cd8989e3a2"
            }
        ],
        "created_date": "2024-06-12 08:58:24"
    },
    {
        "data_source": "oklink",
        "monitored_date": "06/12/2024",
        "results": [
            {
                "time_recorded": "22:54:40",
                "title": "Large transfers",
                "amount": "600,000",
                "token": "USDC",
                "from_address": "Deribit. Hot Wallet",
                "from_wallet_address": "0x77021d475e36b3ab1921a0e3a8380f069d3263de",
                "to_address": "0xa294cca691e4c83b1fc0c8d63d9a3eef0a196de1",
                "to_wallet_address": "0xa294cca691e4c83b1fc0c8d63d9a3eef0a196de1",
                "txn_hash": "0xf0c060a1f047c4101e31099a48917f36d4861fbf7a8aa336ebc856d5b8067a4c"
            },
            {
                "time_recorded": "22:53:52",
                "title": "Large transfers",
                "amount": "650,000",
                "token": "USDC",
                "from_address": "Deribit. Hot Wallet",
                "from_wallet_address": "0x77021d475e36b3ab1921a0e3a8380f069d3263de",
                "to_address": "0xa294cca691e4c83b1fc0c8d63d9a3eef0a196de1",
                "to_wallet_address": "0xa294cca691e4c83b1fc0c8d63d9a3eef0a196de1",
                "txn_hash": "0x6f601a2129206434844a825a4b09801a31f10eda863e5c5630bad2ace0688219"
            },
            {
                "time_recorded": "22:45:02",
                "title": "Large transfers",
                "amount": "800,000",
                "token": "USDC",
                "from_address": "Deribit. Hot Wallet",
                "from_wallet_address": "0x77021d475e36b3ab1921a0e3a8380f069d3263de",
                "to_address": "0xa294cca691e4c83b1fc0c8d63d9a3eef0a196de1",
                "to_wallet_address": "0xa294cca691e4c83b1fc0c8d63d9a3eef0a196de1",
                "txn_hash": "0x77c164f1b3375f6409f819e50d507b34e0666897585eb1673157f7d4aa4ab4a6"
            },
            {
                "time_recorded": "22:09:03",
                "title": "Large transfers",
                "amount": "550,000",
                "token": "USDC",
                "from_address": "Deribit. Hot Wallet",
                "from_wallet_address": "0x77021d475e36b3ab1921a0e3a8380f069d3263de",
                "to_address": "0xa294cca691e4c83b1fc0c8d63d9a3eef0a196de1",
                "to_wallet_address": "0xa294cca691e4c83b1fc0c8d63d9a3eef0a196de1",
                "txn_hash": "0x8d5b63182827e4281b3c8d703ceaec0e4bc925899ebb2e9ca5c4beb70c7d772a"
            },
            {
                "time_recorded": "18:59:03",
                "title": "Large transfers",
                "amount": "999,990",
                "token": "USDT",
                "from_address": "Deribit. Hot Wallet",
                "from_wallet_address": "0x77021d475e36b3ab1921a0e3a8380f069d3263de",
                "to_address": "0xa294cca691e4c83b1fc0c8d63d9a3eef0a196de1",
                "to_wallet_address": "0xa294cca691e4c83b1fc0c8d63d9a3eef0a196de1",
                "txn_hash": "0xed783c7808eb71e15d7374306c3020b765e2f90f69cca29c2644a7089475fa23"
            },
            {
                "time_recorded": "17:21:40",
                "title": "Large transfers",
                "amount": "1,149,998",
                "token": "USDT",
                "from_address": "Deribit. Hot Wallet",
                "from_wallet_address": "0x77021d475e36b3ab1921a0e3a8380f069d3263de",
                "to_address": "0xa294cca691e4c83b1fc0c8d63d9a3eef0a196de1",
                "to_wallet_address": "0xa294cca691e4c83b1fc0c8d63d9a3eef0a196de1",
                "txn_hash": "0x77717ab0b11126fce660339b7571a0c34a6998046656255e14d2ab26979129a6"
            }
        ],
        "created_date": "2024-06-13 08:58:27"
    },
    {
        "data_source": "oklink",
        "monitored_date": "06/13/2024",
        "results": [
            {
                "time_recorded": "22:26:03",
                "title": "Large transfers",
                "amount": "499,996.987352",
                "token": "USDC",
                "from_address": "Deribit. Hot Wallet",
                "from_wallet_address": "0x77021d475e36b3ab1921a0e3a8380f069d3263de",
                "to_address": "0x2997a7a817e4b7ff60082b948a49fdaefc042e4e",
                "to_wallet_address": "0x2997a7a817e4b7ff60082b948a49fdaefc042e4e",
                "txn_hash": "0xd9a53ffd662e2fa2996deef132e3edc1f66a99452620d89b036cd5f090182f53"
            },
            {
                "time_recorded": "09:16:16",
                "title": "Large transfers",
                "amount": "543,006",
                "token": "USDC",
                "from_address": "Deribit. Hot Wallet",
                "from_wallet_address": "0x77021d475e36b3ab1921a0e3a8380f069d3263de",
                "to_address": "0x2997a7a817e4b7ff60082b948a49fdaefc042e4e",
                "to_wallet_address": "0x2997a7a817e4b7ff60082b948a49fdaefc042e4e",
                "txn_hash": "0x889d9cbdb13697656c5cae2d40cdecd6539a9d27c34794d4e5a3506dfa9c75d4"
            },
            {
                "time_recorded": "00:47:51",
                "title": "Large transfers",
                "amount": "1,699,994.74",
                "token": "USDT",
                "from_address": "Deribit. Hot Wallet",
                "from_wallet_address": "0x77021d475e36b3ab1921a0e3a8380f069d3263de",
                "to_address": "0x2997a7a817e4b7ff60082b948a49fdaefc042e4e",
                "to_wallet_address": "0x2997a7a817e4b7ff60082b948a49fdaefc042e4e",
                "txn_hash": "0x1968f39dcdecbe670e194dfe45ac83186e9383a61f801bb3b4c7f20827a3bea9"
            },
            {
                "time_recorded": "00:17:52",
                "title": "Large transfers",
                "amount": "2,000,000",
                "token": "USDC",
                "from_address": "Deribit. Hot Wallet",
                "from_wallet_address": "0x77021d475e36b3ab1921a0e3a8380f069d3263de",
                "to_address": "0x2997a7a817e4b7ff60082b948a49fdaefc042e4e",
                "to_wallet_address": "0x2997a7a817e4b7ff60082b948a49fdaefc042e4e",
                "txn_hash": "0xff4bdc236a6cade124c89a4d36054ebde857d393e166cff550868f783142f1b0"
            }
        ],
        "created_date": "2024-06-14 08:59:00"
    },
    {
        "data_source": "oklink",
        "monitored_date": "06/14/2024",
        "results": [
            {
                "time_recorded": "04:55:14",
                "title": "Large transfers",
                "amount": "2,000,000",
                "token": "USDC",
                "from_address": "0x22ac346c821d6c5b29d10204bf0a95fe05176ab7",
                "from_wallet_address": "0x22ac346c821d6c5b29d10204bf0a95fe05176ab7",
                "to_address": "Deribit. Hot Wallet",
                "to_wallet_address": "0x77021d475e36b3ab1921a0e3a8380f069d3263de",
                "txn_hash": "0x62d7e1293dec818918f9ce76991435fcfa4a49a5947604f34271879c5c94cb2d"
            }
        ],
        "created_date": "2024-06-15 09:03:05"
    },
    {
        "data_source": "oklink",
        "monitored_date": "06/15/2024",
        "results": [
            {
                "time_recorded": "21:02:03",
                "title": "Large transfers",
                "amount": "519,417",
                "token": "USDC",
                "from_address": "Deribit. Hot Wallet",
                "from_wallet_address": "0x77021d475e36b3ab1921a0e3a8380f069d3263de",
                "to_address": "0xa294cca691e4c83b1fc0c8d63d9a3eef0a196de1",
                "to_wallet_address": "0xa294cca691e4c83b1fc0c8d63d9a3eef0a196de1",
                "txn_hash": "0xdc10a69ef8b841d6cfe77dd14dc3a304c28fec44fb28c925fda24af37b69dca0"
            },
            {
                "time_recorded": "14:11:27",
                "title": "Large transfers",
                "amount": "1,998,800",
                "token": "USDC",
                "from_address": "Deribit. Hot Wallet",
                "from_wallet_address": "0x77021d475e36b3ab1921a0e3a8380f069d3263de",
                "to_address": "0xa294cca691e4c83b1fc0c8d63d9a3eef0a196de1",
                "to_wallet_address": "0xa294cca691e4c83b1fc0c8d63d9a3eef0a196de1",
                "txn_hash": "0x97b4da14e608fb57e057cade86b0df03b7710981ccbde13953a7b69e015c0e5f"
            },
            {
                "time_recorded": "03:06:31",
                "title": "Large transfers",
                "amount": "799,997.290402",
                "token": "USDC",
                "from_address": "Deribit. Hot Wallet",
                "from_wallet_address": "0x77021d475e36b3ab1921a0e3a8380f069d3263de",
                "to_address": "0xa294cca691e4c83b1fc0c8d63d9a3eef0a196de1",
                "to_wallet_address": "0xa294cca691e4c83b1fc0c8d63d9a3eef0a196de1",
                "txn_hash": "0xae0dbbf881ada377a0c67d9d55d15ed09dac7d96e45f6d535d535a2614c673c8"
            }
        ],
        "created_date": "2024-06-16 09:02:50"
    },
    {
        "data_source": "oklink",
        "results": [
            {
                "time_recorded": "16:36:03",
                "title": "Large transfers",
                "amount": "500,000",
                "token": "USDC",
                "from_address": "Deribit. Hot Wallet",
                "from_wallet_address": "0x77021d475e36b3ab1921a0e3a8380f069d3263de",
                "to_address": "0xa294cca691e4c83b1fc0c8d63d9a3eef0a196de1",
                "to_wallet_address": "0xa294cca691e4c83b1fc0c8d63d9a3eef0a196de1",
                "txn_hash": "0xed940bc777cc32c53d3aa51e6618b8a9436e1182915b21c7f6be41dba33e87a7"
            }
        ],
        "created_date": "2024-06-17 09:05:33"
    },
    {
        "data_source": "oklink",
        "monitored_date": "06/17/2024",
        "results": [
            {
                "time_recorded": "22:07:03",
                "title": "Large transfers",
                "amount": "1,999,990",
                "token": "USDC",
                "from_address": "Deribit. Hot Wallet",
                "from_wallet_address": "0x77021d475e36b3ab1921a0e3a8380f069d3263de",
                "to_address": "0x258ede9f27da4922efd8543d6c49a6fa98ab842f",
                "to_wallet_address": "0x258ede9f27da4922efd8543d6c49a6fa98ab842f",
                "txn_hash": "0x9789d1f6e2690db2aa06b8a4ab4cb533e9251ebdfdb20fcd3a3b63fd401c09d4"
            }
        ],
        "created_date": "2024-06-18 08:58:46"
    },
    {
        "data_source": "oklink",
        "monitored_date": "06/18/2024",
        "results": [
            {
                "time_recorded": "22:44:52",
                "title": "Large transfers",
                "amount": "529,362",
                "token": "USDT",
                "from_address": "0x22ac346c821d6c5b29d10204bf0a95fe05176ab7",
                "from_wallet_address": "0x22ac346c821d6c5b29d10204bf0a95fe05176ab7",
                "to_address": "Deribit. Hot Wallet",
                "to_wallet_address": "0x77021d475e36b3ab1921a0e3a8380f069d3263de",
                "txn_hash": "0xa0c60b51cb224a31345d3755526e92b2b5c9cf25a82dd3b9334327af4ca315dc"
            },
            {
                "time_recorded": "22:42:14",
                "title": "Large transfers",
                "amount": "769,990",
                "token": "USDC",
                "from_address": "0x22ac346c821d6c5b29d10204bf0a95fe05176ab7",
                "from_wallet_address": "0x22ac346c821d6c5b29d10204bf0a95fe05176ab7",
                "to_address": "Deribit. Hot Wallet",
                "to_wallet_address": "0x77021d475e36b3ab1921a0e3a8380f069d3263de",
                "txn_hash": "0x9808fd0f4776ba29c68ed595de296e1d4bc739c1a5775bf51951a127f83694c5"
            }
        ],
        "created_date": "2024-06-19 08:59:15"
    },
    {
        "data_source": "oklink",
        "monitored_date": "06/19/2024",
        "results": [
            {
                "time_recorded": "15:37:05",
                "title": "Large transfers",
                "amount": "10,994,502",
                "token": "USDC",
                "from_address": "Deribit. Hot Wallet",
                "from_wallet_address": "0x77021d475e36b3ab1921a0e3a8380f069d3263de",
                "to_address": "0x258ede9f27da4922efd8543d6c49a6fa98ab842f",
                "to_wallet_address": "0x258ede9f27da4922efd8543d6c49a6fa98ab842f",
                "txn_hash": "0xb438bc864ae0e82c2f910f2448b484e0da7c3fca11aca7f35c5ba402f7684531"
            },
            {
                "time_recorded": "02:17:15",
                "title": "Large transfers",
                "amount": "499,998.335602",
                "token": "USDC",
                "from_address": "Deribit. Hot Wallet",
                "from_wallet_address": "0x77021d475e36b3ab1921a0e3a8380f069d3263de",
                "to_address": "0x258ede9f27da4922efd8543d6c49a6fa98ab842f",
                "to_wallet_address": "0x258ede9f27da4922efd8543d6c49a6fa98ab842f",
                "txn_hash": "0x3bd31490dd2b87973f3501c7854dfce8f0411eea804b0ee4deb501cc09e507b8"
            },
            {
                "time_recorded": "00:06:52",
                "title": "Large transfers",
                "amount": "539,014",
                "token": "USDT",
                "from_address": "Deribit. Hot Wallet",
                "from_wallet_address": "0x77021d475e36b3ab1921a0e3a8380f069d3263de",
                "to_address": "0x258ede9f27da4922efd8543d6c49a6fa98ab842f",
                "to_wallet_address": "0x258ede9f27da4922efd8543d6c49a6fa98ab842f",
                "txn_hash": "0x4db49d6e4bdaa05715ee390ef44b5c2a7a00ad2205a7bb20049e839939400802"
            }
        ],
        "created_date": "2024-06-20 08:59:19"
    },
    {
        "data_source": "oklink",
        "monitored_date": "06/20/2024",
        "results": [
            {
                "time_recorded": "04:17:27",
                "title": "Large transfers",
                "amount": "5,499,990",
                "token": "USDC",
                "from_address": "Deribit. Hot Wallet",
                "from_wallet_address": "0x77021d475e36b3ab1921a0e3a8380f069d3263de",
                "to_address": "0xc86b95b9021644577f1fdd387c7aeabeb171f789",
                "to_wallet_address": "0xc86b95b9021644577f1fdd387c7aeabeb171f789",
                "txn_hash": "0x9298c2b33e523810febfdc211907f293bf64f9fbaf92bf9d9acb55673e161d31"
            }
        ],
        "created_date": "2024-06-21 08:56:41"
    },
    {
        "data_source": "oklink",
        "results": [
            {
                "time_recorded": "22:26:03",
                "title": "Large transfers",
                "amount": "499,996.987352",
                "token": "USDC",
                "from_address": "Deribit. Hot Wallet",
                "from_wallet_address": "0x77021d475e36b3ab1921a0e3a8380f069d3263de",
                "to_address": "Binance. Exchange User",
                "to_wallet_address": "0xa7145e00c87414c8d6cdd03ce1fdecff7cd07b0f",
                "txn_hash": "0xd9a53ffd662e2fa2996deef132e3edc1f66a99452620d89b036cd5f090182f53"
            },
            {
                "time_recorded": "09:16:16",
                "title": "Large transfers",
                "amount": "543,006",
                "token": "USDC",
                "from_address": "Deribit. Hot Wallet",
                "from_wallet_address": "0x77021d475e36b3ab1921a0e3a8380f069d3263de",
                "to_address": "Binance. Exchange User",
                "to_wallet_address": "0xa7145e00c87414c8d6cdd03ce1fdecff7cd07b0f",
                "txn_hash": "0x889d9cbdb13697656c5cae2d40cdecd6539a9d27c34794d4e5a3506dfa9c75d4"
            }
        ],
        "created_date": "2024-06-25 09:00:52"
    },
    {
        "data_source": "oklink",
        "monitored_date": "06/25/2024",
        "results": [],
        "created_date": "2024-06-26 08:58:55"
    },
    {
        "data_source": "oklink",
        "monitored_date": "06/26/2024",
        "results": [],
        "created_date": "2024-06-27 08:59:03"
    },
    {
        "data_source": "oklink",
        "monitored_date": "06/27/2024",
        "results": [],
        "created_date": "2024-06-28 09:00:04"
    },
    {
        "data_source": "oklink",
        "results": [],
        "created_date": "2024-06-29 08:59:21"
    },
    {
        "data_source": "oklink",
        "results": [
            {
                "time_recorded": "21:02:03",
                "title": "Large transfers",
                "amount": "519,417",
                "token": "USDC",
                "from_address": "Deribit. Hot Wallet",
                "from_wallet_address": "0x77021d475e36b3ab1921a0e3a8380f069d3263de",
                "to_address": "Binance. Exchange User",
                "to_wallet_address": "0xa7145e00c87414c8d6cdd03ce1fdecff7cd07b0f",
                "txn_hash": "0xdc10a69ef8b841d6cfe77dd14dc3a304c28fec44fb28c925fda24af37b69dca0"
            },
            {
                "time_recorded": "14:11:27",
                "title": "Large transfers",
                "amount": "1,998,800",
                "token": "USDC",
                "from_address": "Deribit. Hot Wallet",
                "from_wallet_address": "0x77021d475e36b3ab1921a0e3a8380f069d3263de",
                "to_address": "Binance. Exchange User",
                "to_wallet_address": "0xa7145e00c87414c8d6cdd03ce1fdecff7cd07b0f",
                "txn_hash": "0x97b4da14e608fb57e057cade86b0df03b7710981ccbde13953a7b69e015c0e5f"
            },
            {
                "time_recorded": "03:06:31",
                "title": "Large transfers",
                "amount": "799,997.290402",
                "token": "USDC",
                "from_address": "Deribit. Hot Wallet",
                "from_wallet_address": "0x77021d475e36b3ab1921a0e3a8380f069d3263de",
                "to_address": "Binance. Exchange User",
                "to_wallet_address": "0xa7145e00c87414c8d6cdd03ce1fdecff7cd07b0f",
                "txn_hash": "0xae0dbbf881ada377a0c67d9d55d15ed09dac7d96e45f6d535d535a2614c673c8"
            }
        ],
        "created_date": "2024-06-30 09:01:41"
    },
    {
        "data_source": "oklink",
        "results": [
            {
                "time_recorded": "04:55:14",
                "title": "Large transfers",
                "amount": "2,000,000",
                "token": "USDC",
                "from_address": "Deribit. Hot Wallet",
                "from_wallet_address": "0x77021d475e36b3ab1921a0e3a8380f069d3263de",
                "to_address": "Binance. Exchange User",
                "to_wallet_address": "0xa7145e00c87414c8d6cdd03ce1fdecff7cd07b0f",
                "txn_hash": "0x62d7e1293dec818918f9ce76991435fcfa4a49a5947604f34271879c5c94cb2d"
            }
        ],
        "created_date": "2024-07-01 09:05:50"
    },
    {
        "data_source": "oklink",
        "results": [],
        "created_date": "2024-07-02 08:58:29"
    },
    {
        "data_source": "oklink",
        "monitored_date": "07/02/2024",
        "results": [],
        "created_date": "2024-07-03 09:01:00"
    },
    {
        "data_source": "oklink",
        "monitored_date": "07/03/2024",
        "results": [],
        "created_date": "2024-07-04 09:00:37"
    },
    {
        "data_source": "oklink",
        "monitored_date": "07/04/2024",
        "results": [],
        "created_date": "2024-07-05 09:00:59"
    },
    {
        "data_source": "oklink",
        "monitored_date": "07/05/2024",
        "results": [],
        "created_date": "2024-07-06 08:56:57"
    },
    {
        "data_source": "oklink",
        "monitored_date": "07/06/2024",
        "results": [],
        "created_date": "2024-07-07 09:03:11"
    },
    {
        "data_source": "oklink",
        "results": [
            {
                "time_recorded": "21:02:03",
                "title": "Large transfers",
                "amount": "519,417",
                "token": "USDC",
                "from_address": "Deribit. Hot Wallet",
                "from_wallet_address": "0x77021d475e36b3ab1921a0e3a8380f069d3263de",
                "to_address": "Binance. Exchange User",
                "to_wallet_address": "0xa7145e00c87414c8d6cdd03ce1fdecff7cd07b0f",
                "txn_hash": "0xdc10a69ef8b841d6cfe77dd14dc3a304c28fec44fb28c925fda24af37b69dca0"
            },
            {
                "time_recorded": "14:11:27",
                "title": "Large transfers",
                "amount": "1,998,800",
                "token": "USDC",
                "from_address": "Deribit. Hot Wallet",
                "from_wallet_address": "0x77021d475e36b3ab1921a0e3a8380f069d3263de",
                "to_address": "Binance. Exchange User",
                "to_wallet_address": "0xa7145e00c87414c8d6cdd03ce1fdecff7cd07b0f",
                "txn_hash": "0x97b4da14e608fb57e057cade86b0df03b7710981ccbde13953a7b69e015c0e5f"
            }
        ],
        "created_date": "2024-07-08 09:02:50"
    },
    {
        "data_source": "oklink",
        "monitored_date": "07/08/2024",
        "results": [],
        "created_date": "2024-07-09 08:59:15"
    },
    {
        "data_source": "oklink",
        "monitored_date": "07/09/2024",
        "results": [],
        "created_date": "2024-07-10 09:02:15"
    },
    {
        "data_source": "oklink",
        "monitored_date": "07/10/2024",
        "results": [],
        "created_date": "2024-07-11 09:10:08"
    },
    {
        "data_source": "oklink",
        "monitored_date": "07/11/2024",
        "results": [],
        "created_date": "2024-07-12 09:07:23"
    },
    {
        "data_source": "oklink",
        "monitored_date": "07/13/2024",
        "results": [],
        "created_date": "2024-07-14 09:11:10"
    },
    {
        "data_source": "oklink",
        "monitored_date": "07/14/2024",
        "results": [],
        "created_date": "2024-07-15 09:04:48"
    },
    {
        "data_source": "oklink",
        "monitored_date": "07/15/2024",
        "results": [],
        "created_date": "2024-07-16 09:03:30"
    },
    {
        "data_source": "oklink",
        "monitored_date": "07/16/2024",
        "results": [],
        "created_date": "2024-07-17 09:07:48"
    },
    {
        "data_source": "oklink",
        "monitored_date": "07/17/2024",
        "results": [],
        "created_date": "2024-07-18 09:05:01"
    },
    {
        "data_source": "oklink",
        "monitored_date": "07/18/2024",
        "results": [],
        "created_date": "2024-07-19 09:05:37"
    },
    {
        "data_source": "oklink",
        "monitored_date": "07/19/2024",
        "results": [],
        "created_date": "2024-07-20 09:07:31"
    },
    {
        "data_source": "oklink",
        "monitored_date": "07/20/2024",
        "results": [],
        "created_date": "2024-07-21 09:07:55"
    },
    {
        "data_source": "oklink",
        "monitored_date": "07/21/2024",
        "results": [],
        "created_date": "2024-07-22 09:11:03"
    },
    {
        "data_source": "oklink",
        "monitored_date": "07/22/2024",
        "results": [],
        "created_date": "2024-07-23 09:04:39"
    },
    {
        "data_source": "oklink",
        "monitored_date": "07/23/2024",
        "results": [],
        "created_date": "2024-07-24 09:04:08"
    },
    {
        "data_source": "oklink",
        "monitored_date": "07/24/2024",
        "results": [],
        "created_date": "2024-07-25 09:08:45"
    },
    {
        "data_source": "oklink",
        "monitored_date": "07/25/2024",
        "results": [],
        "created_date": "2024-07-26 09:12:44"
    },
    {
        "data_source": "oklink",
        "monitored_date": "07/26/2024",
        "results": [],
        "created_date": "2024-07-27 09:05:11"
    },
    {
        "data_source": "oklink",
        "monitored_date": "07/27/2024",
        "results": [],
        "created_date": "2024-07-28 09:11:19"
    },
    {
        "data_source": "oklink",
        "monitored_date": "07/28/2024",
        "results": [],
        "created_date": "2024-07-29 09:07:12"
    },
    {
        "data_source": "oklink",
        "monitored_date": "07/29/2024",
        "results": [],
        "created_date": "2024-07-30 09:10:00"
    },
    {
        "data_source": "oklink",
        "monitored_date": "07/30/2024",
        "results": [],
        "created_date": "2024-07-31 08:56:16"
    },
    {
        "data_source": "oklink",
        "monitored_date": "07/31/2024",
        "results": [],
        "created_date": "2024-08-01 09:13:12"
    },
    {
        "data_source": "oklink",
        "monitored_date": "08/01/2024",
        "results": [],
        "created_date": "2024-08-02 09:15:04"
    },
    {
        "data_source": "oklink",
        "results": [],
        "created_date": "2024-08-03 09:12:15"
    },
    {
        "data_source": "oklink",
        "monitored_date": "08/03/2024",
        "results": [],
        "created_date": "2024-08-04 09:19:50"
    },
    {
        "data_source": "oklink",
        "monitored_date": "08/04/2024",
        "results": [],
        "created_date": "2024-08-05 09:22:34"
    },
    {
        "data_source": "oklink",
        "monitored_date": "08/05/2024",
        "results": [],
        "created_date": "2024-08-06 09:12:51"
    },
    {
        "data_source": "oklink",
        "monitored_date": "08/06/2024",
        "results": [],
        "created_date": "2024-08-07 09:32:26"
    },
    {
        "data_source": "oklink",
        "monitored_date": "08/07/2024",
        "results": [],
        "created_date": "2024-08-08 09:34:24"
    },
    {
        "data_source": "oklink",
        "monitored_date": "08/08/2024",
        "results": [],
        "created_date": "2024-08-09 09:33:30"
    },
    {
        "data_source": "oklink",
        "monitored_date": "08/09/2024",
        "results": [],
        "created_date": "2024-08-10 09:28:30"
    },
    {
        "data_source": "oklink",
        "monitored_date": "08/10/2024",
        "results": [],
        "created_date": "2024-08-11 09:39:47"
    },
    {
        "data_source": "oklink",
        "monitored_date": "08/11/2024",
        "results": [],
        "created_date": "2024-08-12 09:25:11"
    },
    {
        "data_source": "oklink",
        "results": [],
        "created_date": "2024-08-14 09:35:39"
    },
    {
        "data_source": "oklink",
        "monitored_date": "08/14/2024",
        "results": [],
        "created_date": "2024-08-15 09:28:33"
    },
    {
        "data_source": "oklink",
        "monitored_date": "08/15/2024",
        "results": [],
        "created_date": "2024-08-16 09:23:59"
    },
    {
        "data_source": "oklink",
        "monitored_date": "08/16/2024",
        "results": [],
        "created_date": "2024-08-17 09:22:41"
    },
    {
        "data_source": "oklink",
        "monitored_date": "08/17/2024",
        "results": [],
        "created_date": "2024-08-18 09:34:08"
    },
    {
        "data_source": "oklink",
        "monitored_date": "08/18/2024",
        "results": [],
        "created_date": "2024-08-19 09:31:54"
    },
    {
        "data_source": "oklink",
        "results": [],
        "created_date": "2024-08-20 09:33:30"
    },
    {
        "data_source": "oklink",
        "results": [],
        "created_date": "2024-08-21 09:34:56"
    },
    {
        "data_source": "oklink",
        "monitored_date": "08/21/2024",
        "results": [],
        "created_date": "2024-08-22 09:27:13"
    },
    {
        "data_source": "oklink",
        "monitored_date": "08/22/2024",
        "results": [],
        "created_date": "2024-08-23 09:34:08"
    },
    {
        "data_source": "oklink",
        "monitored_date": "08/26/2024",
        "results": [],
        "created_date": "2024-08-27 09:58:26"
    },
    {
        "data_source": "oklink",
        "monitored_date": "08/29/2024",
        "results": [],
        "created_date": "2024-08-30 10:26:37"
    },
    {
        "data_source": "oklink",
        "monitored_date": "09/04/2024",
        "results": [],
        "created_date": "2024-09-05 09:39:53"
    },
    {
        "data_source": "oklink",
        "monitored_date": "09/07/2024",
        "results": [],
        "created_date": "2024-09-08 09:28:43"
    },
    {
        "data_source": "oklink",
        "monitored_date": "09/09/2024",
        "results": [],
        "created_date": "2024-09-10 09:11:51"
    },
    {
        "data_source": "oklink",
        "monitored_date": "09/10/2024",
        "results": [],
        "created_date": "2024-09-11 09:22:08"
    },
    {
        "data_source": "oklink",
        "monitored_date": "09/11/2024",
        "results": [],
        "created_date": "2024-09-12 09:16:24"
    },
    {
        "data_source": "oklink",
        "monitored_date": "09/13/2024",
        "results": [],
        "created_date": "2024-09-14 09:12:27"
    },
    {
        "data_source": "oklink",
        "monitored_date": "09/15/2024",
        "results": [],
        "created_date": "2024-09-16 09:16:38"
    },
    {
        "data_source": "oklink",
        "monitored_date": "09/17/2024",
        "results": [],
        "created_date": "2024-09-18 09:29:21"
    },
    {
        "data_source": "oklink",
        "monitored_date": "09/18/2024",
        "results": [],
        "created_date": "2024-09-19 09:28:24"
    },
    {
        "data_source": "oklink",
        "results": [],
        "created_date": "2024-09-20 09:51:30"
    },
    {
        "data_source": "oklink",
        "monitored_date": "09/20/2024",
        "results": [],
        "created_date": "2024-09-21 10:34:57"
    },
    {
        "data_source": "oklink",
        "monitored_date": "09/21/2024",
        "results": [],
        "created_date": "2024-09-22 09:32:20"
    },
    {
        "data_source": "oklink",
        "results": [],
        "created_date": "2024-09-23 09:28:46"
    },
    {
        "data_source": "oklink",
        "monitored_date": "09/25/2024",
        "results": [
            {
                "time_recorded": "20:25:27",
                "title": "Large transfers",
                "amount": "1,500,000",
                "token": "USDC",
                "from_address": "Deribit. Hot Wallet_1",
                "from_wallet_address": "0x77021d475e36b3ab1921a0e3a8380f069d3263de",
                "to_address": "0xc520ad8fe352658f5d0fab4bae29a8a3941e71b3",
                "to_wallet_address": "0xc520ad8fe352658f5d0fab4bae29a8a3941e71b3",
                "txn_hash": "0x45e2118371dfe4d383f14b9c89944d269c95f4329bbbac81fb225336e32e5190"
            }
        ],
        "created_date": "2024-09-26 09:32:43"
    }
]